,title,description,published date,url,publisher,source,content
83,予國民黨開除 李正皓代表橘營選中和立委 ｜ 公視新聞網 PNN - 公視新聞,予國民黨開除 李正皓代表橘營選中和立委 ｜ 公視新聞網 PNN  公視新聞,"Fri, 22 Nov 2019 08:00:00 GMT",https://news.google.com/rss/articles/CBMiJmh0dHBzOi8vbmV3cy5wdHMub3JnLnR3L2FydGljbGUvNDU1Njk40gEqaHR0cHM6Ly9uZXdzLnB0cy5vcmcudHcvYXJ0aWNsZS80NTU2OTgvYW1w?oc=5&hl=en-US&gl=US&ceid=US:en,"{'href': 'https://news.pts.org.tw', 'title': '公視新聞'}",pts,                                        本底是國民黨內的青年派，煞因為定咧批評韓國瑜，煞去予黨中央開除的李正皓，今仔日由親民黨副總統的參選人余湘陪伴，登記欲參選新北市中和區的立法委員。李正皓講，伊嘛有和郭台銘先生會過，決定欲攑親民黨這支旗。這局伊的對手，正正就是國民黨提名、韓國瑜嘛大力咧扶持的邱烽堯議員，閣有民進黨現任的江永昌立委。喊著口號，披橘袍出征的草協聯盟發起人李正皓，強調自己參選的決定很倉促，18號才決定，可是準備很久，未來會一天當兩天用，讓中和選民多一個選擇。由於李正皓常在媒體，批評國民黨總統參選人韓國瑜，將對上被視為「韓家軍」的議員邱烽堯，以尋求連任的綠委江永昌，成為話題。==親民黨立委參選人 李正皓==兩大黨政黨支持度很少低於7成現在是史無前例的低所以我這次出來不是搶藍的25%也不是搶民進黨的25%我搶的是不知道選給誰的那50%==親民黨副總統參選人 余湘==政治人物最重要的就是要無私你從政的初心是什麼如果你真的是要為人民服務就請記得你的初心是什麼余湘鼓勵李正皓為人民服務，要記得初心，列名親民黨不分的郭台銘幕僚蔡沁瑜，也證實鴻海郭台銘曾與李正皓見面，鼓勵他參選立委，經過三方協調，決定以親民黨名義參選。==永齡基金會副執行長 蔡沁瑜==這之前 其實也跟這個郭台銘先生見過面通常也是有一個晚輩向長輩請益的概念那原則上我們也希望說能夠為台灣的自由努力蔡沁渝強調，郭台銘未來如果時間允許，一定會幫李正皓站台。而李正皓22號的登記行程，原本是親民黨主席宋楚瑜要陪同，後來改為余湘？對此，親民黨強調，未來宋楚瑜也會幫李正皓輔選，也希望選民給年輕人服務的機會。記者 陳佳鑫 蔣龍祥 新北市報導                 
84,遭國民黨開除 李正皓披橘袍選中和立委 ｜ 公視新聞網 PNN - 公視新聞,遭國民黨開除 李正皓披橘袍選中和立委 ｜ 公視新聞網 PNN  公視新聞,"Fri, 22 Nov 2019 08:00:00 GMT",https://news.google.com/rss/articles/CBMiJmh0dHBzOi8vbmV3cy5wdHMub3JnLnR3L2FydGljbGUvNDU1NjY20gEqaHR0cHM6Ly9uZXdzLnB0cy5vcmcudHcvYXJ0aWNsZS80NTU2NjYvYW1w?oc=5&hl=en-US&gl=US&ceid=US:en,"{'href': 'https://news.pts.org.tw', 'title': '公視新聞'}",pts,一直批評韓國瑜，被國民黨開除黨籍的草協聯盟發起人李正皓，今天到新北市選委會登記，要代表親民黨參選新北市中和立委，李正皓證實，有向鴻海創辦人郭台銘請益協調後，決定披橘袍出征。喊著口號，披橘袍出征的草協聯盟發起人李正皓，強調自己參選的決定很倉促，18日才決定，可是準備很久，未來會一天當兩天用，讓中和選民多一個選擇。由於李正皓常在媒體批評國民黨總統參選人韓國瑜，將對上被視為「韓家軍」的議員邱烽堯，以及尋求連任的綠委江永昌，成為話題。李正皓表示，「兩大黨政黨支持度，很少低於7成，現在是史無前例的低，所以我這次出來，不是搶藍的25%，也不是搶民進黨的25%，我搶的是不知道選給誰的那50%。」親民黨副總統參選人余湘說，「政治人物最重要的就是要無私，你從政的初心是什麼，如果你真的是要為人民服務，就請記得你的初心是什麼。」余湘鼓勵李正皓為人民服務，要記得初心，列名親民黨不分的郭台銘幕僚蔡沁瑜，也證實鴻海郭台銘曾與李正皓見面，鼓勵他參選立委，經過三方協調，決定以親民黨名義參選。蔡沁瑜表示，「這之前，其實也跟郭台銘先生見過面，通常也是有一個晚輩向長輩請益的概念，那原則上我們也希望說，能夠為台灣的自由努力。」她強調，郭台銘未來如果時間允許，一定會幫李正皓站台。 而李正皓22日的登記行程，原本是親民黨主席宋楚瑜要陪同，為何後來改為余湘？對此，親民黨強調，未來宋楚瑜也會幫李正皓輔選，也希望選民給年輕人服務的機會。 
85,前花蓮縣長傅崐萁無黨籍身分參選立委 ｜ 公視新聞網 PNN - 公視新聞,前花蓮縣長傅崐萁無黨籍身分參選立委 ｜ 公視新聞網 PNN  公視新聞,"Thu, 21 Nov 2019 08:00:00 GMT",https://news.google.com/rss/articles/CBMiJmh0dHBzOi8vbmV3cy5wdHMub3JnLnR3L2FydGljbGUvNDU1NTky0gEqaHR0cHM6Ly9uZXdzLnB0cy5vcmcudHcvYXJ0aWNsZS80NTU1OTIvYW1w?oc=5&hl=en-US&gl=US&ceid=US:en,"{'href': 'https://news.pts.org.tw', 'title': '公視新聞'}",pts,                                        前花蓮縣長傅崐萁，在妻子國民黨籍縣長徐榛蔚，還有大批支持者的陪同下，以無黨籍身分登記參選花蓮區域立委，但因為國民黨已經在花蓮提名黃啟嘉了，所以傅崐萁參選將造成泛藍分裂。對此，傅崐萁說自己是正藍最強參選人，要整合泛藍支持、下架民進黨。在支持者的歡呼下，六百多位民眾擠爆現場，有的舉著韓國瑜旗幟的黨工，也有國民黨籍基層民代，前花蓮縣長傅崐萁與妻子現任花蓮縣長徐榛蔚，攜手走進縣選委會，以「無黨籍身分」登記參選花蓮縣立委，為花蓮選情投下震撼彈。傅崐萁說：「我三次申請回復國民黨黨籍三次都被擱置，(要求國民黨推出)花蓮泛藍最強棒，但是我們一直等到最後沒有任何的裁示跟結果，我想我們花蓮人一向沒人疼，我們自己拚，鄉親做靠山，你們說好不好？」選在立委參選登記截止日前出手參選，傅崑萁展現八年縣長人脈加上現任縣長徐榛蔚的花蓮政治實力。對於花蓮泛藍陷分裂。傅崐萁強調自己才是正藍軍，自己才是藍營最強棒。而徐榛蔚高調相挺，是否會遭黨紀處分？徐榛蔚表示：「因為我們黨章的部分，對於候選人的配偶以及親屬是可以報准的，我已經有跟中央黨部報備了。」國民黨花蓮縣黨部秘書長胡慧君說：「因為中央現在才剛剛收到信。」至於那算違紀、偷跑嗎？胡慧君只是嘆了口氣。面對是否會懲處，國民黨花蓮縣黨部話說的保留，但國民黨無論是否和傅崐萁正式決裂?國民黨立委參選人黃啟嘉表示會參選到底。黃啟嘉說：「我是國民黨提名唯一候選人，因為有很多混淆新聞講說跟無黨籍有一些暗盤交易，這些都完全沒有的事情，如果韓國瑜總統候選人，本黨候選人來，一定是到本黨立委候選人總部。」泛藍出現分裂局勢，而11月27號，黃啟嘉花蓮聯合競選總部成立，預計找來韓國瑜到場站台。韓國瑜如何表態也勢必牽動花蓮藍營的選情。                 
86,張善政陪吳志揚登記 ﱇ懸藍營選情 ｜ 公視新聞網 PNN - 公視新聞,張善政陪吳志揚登記 ﱇ懸藍營選情 ｜ 公視新聞網 PNN  公視新聞,"Wed, 20 Nov 2019 08:00:00 GMT",https://news.google.com/rss/articles/CBMiJmh0dHBzOi8vbmV3cy5wdHMub3JnLnR3L2FydGljbGUvNDU1MzYz0gEqaHR0cHM6Ly9uZXdzLnB0cy5vcmcudHcvYXJ0aWNsZS80NTUzNjMvYW1w?oc=5&hl=en-US&gl=US&ceid=US:en,"{'href': 'https://news.pts.org.tw', 'title': '公視新聞'}",pts,                                        國民黨副總統的參選人張善政，早起陪伴黨內佇咧桃園市提名的立法委員吳志揚，一行人騎鐵馬去登記。伊也大力咧批評交通部有提起講，「臺中國際機場」的工程，工期只要3冬就起會起來，這是無影無跡的話語，若是照張善政的算法，頭尾著愛21冬，這片國際機場才起會完成。==國民黨副總統參選人 張善政==現在桃園三航廈連房子都蓋不出來他還敢誇口說3年要把新的台中機場能夠蓋好3年完成土建對不對可是機場只有土建嗎機場裡面要有這種電腦通關各式各樣的東西他真正講的是2040年對不對2040年 21年做一個國際機場我告訴各位這是國際笑話==韓國瑜競總發言人 何庭歡==韓國瑜夫婦他們一家人所有的房產交易的話 所有資訊都在上一次記者會已經有公布那因為這棟是屬於這棟房產在大安區的房產是屬於他親屬的所以這部分的話因為我們要尊重這名親屬他並不是公眾人物所以我們要尊重說他有自己的隱私權雖然張善政，是當無閒咧參中央政府，一句來一句去，毋過，總統參選人韓國瑜這爿，煞又閣去予媒體煏講，嘛捌佇台北市大安區，蓄一間樓仔厝，抑彼搭的厝邊頭尾嘛有承認，韓先生彼家口仔，有影捌踮遐，徛起佮行踏。總是，韓國瑜競選辦公室的何庭歡發言人有出來掰講，若彼筆房地產的名，是韓--家的親情的，和韓國瑜翁仔某，全然攏無牽連。                 
87,賴清德回台南輔選郭國文 低調回應台獨 ｜ 公視新聞網 PNN - 公視新聞,賴清德回台南輔選郭國文 低調回應台獨 ｜ 公視新聞網 PNN  公視新聞,"Thu, 21 Nov 2019 08:00:00 GMT",https://news.google.com/rss/articles/CBMiJmh0dHBzOi8vbmV3cy5wdHMub3JnLnR3L2FydGljbGUvNDU1NTA50gEqaHR0cHM6Ly9uZXdzLnB0cy5vcmcudHcvYXJ0aWNsZS80NTU1MDkvYW1w?oc=5&hl=en-US&gl=US&ceid=US:en,"{'href': 'https://news.pts.org.tw', 'title': '公視新聞'}",pts,                                        民進黨副總統參選人賴清德在台南替立委參選人郭國文站台，受到熱烈歡迎，不過，針對國民黨副總統候選人張善政猛打台獨議題沒多說。被張善政質疑你的台獨立場，賴清德回應：「哈哈哈，沒有，那個其實我已經講得很清楚了，就沒有再重複。」而對於陳水扁同意列為)一邊一國行動黨的不分區立委有什麼看法？賴清德說：「其實我關心的是他的健康，因為其實國人對蔡英文總統的支持，其實很多也是源自於對他健康人權的維護，那我們希望他的健康能夠好好照顧。」至於前總統陳水扁同意列為一邊一國行動黨的不分區名單，賴情德沒正面回應，而是強調他最關心的是陳前總統的身體安危，其餘交由相關單位處理說明。                 
88,不滿被綠營抹紅 柯文哲再批台獨是欺騙 ｜ 公視新聞網 PNN - 公視新聞,不滿被綠營抹紅 柯文哲再批台獨是欺騙 ｜ 公視新聞網 PNN  公視新聞,"Thu, 21 Nov 2019 08:00:00 GMT",https://news.google.com/rss/articles/CBMiJmh0dHBzOi8vbmV3cy5wdHMub3JnLnR3L2FydGljbGUvNDU1NTA40gEqaHR0cHM6Ly9uZXdzLnB0cy5vcmcudHcvYXJ0aWNsZS80NTU1MDgvYW1w?oc=5&hl=en-US&gl=US&ceid=US:en,"{'href': 'https://news.pts.org.tw', 'title': '公視新聞'}",pts,                                        台北市長柯文哲要拚選舉，批評台獨說他們子孫都留在國外，今天更表明他就是不滿被抹紅，還批評加入民進黨不分區的前社民黨主席范雲，說她被民進黨收買。台北市長柯文哲領軍的台灣民眾黨，積極搶進2020的國會殿堂，矛頭對準民進黨，前一天才語出驚人的批評台獨是騙子，上午出席電競活動時，再加碼表明就是不滿被抹紅。柯文哲說：「我最討厭給人家抹紅，我跟你講，我們是很務實在處理這個要怎麼解決，不要每天給人家扣帽子，你扣帽子有時候不高興，我就給你打回去，全家都移民紐西蘭，每年在台灣辦募款餐會，台獨募款餐會我看了就不順眼。」對於民進黨副總統參選人賴清德主張自己是「務實台獨工作者」，遭國民黨總統參選人韓國瑜反嗆這是欺騙，柯文哲不願多談，只強調台灣是一個主權獨立國家，但只是不正常。柯文哲左批台獨，右打前社民黨主席范雲，說她列入民進黨不分區名單是被收買，引發范雲爆料回擊。范雲說：「柯市長這樣說踩到了我的底線，所以我昨天晚上就說出，柯市長在2014年和2018年都曾經派人來邀請我擔任他的副市長。」柯文哲卻說：「應該去問她，去追問她中間人是誰我順便查一下，我們旁邊是誰在當掮客，只有三個可能嘛，一個是她被騙，一個她說謊，一個是媽祖託夢。」柯文哲話回得一點也不客氣，反問誰是中間人？兩人隔空互嗆。范雲認為：「柯市長不能夠對人跟事如此的雙重標準，那願意跟他合作的就是政治找回自己的良心；沒有跟他合作的就是出賣，就是利益交換。」柯文哲又說：「被收買就被收買，囉哩叭嗦幹什麼，你黨都沒有了你還囉嗦什麼？」是否認為范雲背棄自己的選民？柯文哲欲言又止，最後用公司併購改組來形容，是常有的事。                 
89,韓張合體發表國政白皮書 提26項政策 ｜ 公視新聞網 PNN - 公視新聞,韓張合體發表國政白皮書 提26項政策 ｜ 公視新聞網 PNN  公視新聞,"Fri, 29 Nov 2019 08:00:00 GMT",https://news.google.com/rss/articles/CBMiJmh0dHBzOi8vbmV3cy5wdHMub3JnLnR3L2FydGljbGUvNDU2NzA10gEqaHR0cHM6Ly9uZXdzLnB0cy5vcmcudHcvYXJ0aWNsZS80NTY3MDUvYW1w?oc=5&hl=en-US&gl=US&ceid=US:en,"{'href': 'https://news.pts.org.tw', 'title': '公視新聞'}",pts,                                        國民黨總統參選人韓國瑜合體副手張善政，在29號發表國家政策白皮書，對於外交、國防和兩岸等議題提出26項政策，其中也包含108課綱檢討，還有公投法修正等等。至於備受關注的國防政策，著重預防戰爭。韓國瑜更表明三個絕對，強調反對台獨、反對一國兩制。至於妻子李佳芬家族的盜採砂石疑雲，韓國瑜態度很低調。韓國瑜說：「鞏固中華民國的國防，確保台海兩岸的和平，反對台獨，反對一國兩制，台灣安全人民有錢的執政目標絕不改變。」張善政說：「有系統地端出我們的牛肉，我們希望從今天開始，我們的這個選舉可以真的導向政策跟政見的討論，而不要再繼續黑來黑去。」韓國瑜下午也聽取電商建言，要為全球電商營業額1兆美金的龐大商機找出路，思考如何協助業者。除了猛端政見牛肉，韓國瑜反擊民調，要大家接電話都說支持蔡英文，卻被學者質疑，恐怕拖累藍營立委選情。韓國瑜說：｢學者應該更擔心的是為什麼台灣民主後退，台灣媒體墮落，為什麼假民調滿天飛？而不應該來問我的臉書，所發表我的看法，對於假民調的抵制。」對於蔡總統批評韓國瑜，政見總是跳票，韓國瑜拿出666幼兒補助專案，批評蔡英文抄襲模仿，但只要能幫助台灣，還是樂觀其成。至於李佳芬家族被立委黃國昌爆出盜採砂石案，還拿出有韓國瑜簽名的公文，質疑韓國瑜涉嫌關說。韓國瑜回應：「我們發言團體會針對發言這個問題，那我想在這裡就不便多表述，我們一切很多事情都依法，我很多話實在是，總統候選人身分不願意講太多。」韓國瑜一度拒答，還強調身為總統參選人不便講太多，交由發言人回應。                 
90,不分區立委政黨號次出爐 19政黨提逾200人 ｜ 公視新聞網 PNN - 公視新聞,不分區立委政黨號次出爐 19政黨提逾200人 ｜ 公視新聞網 PNN  公視新聞,"Wed, 18 Dec 2019 08:00:00 GMT",https://news.google.com/rss/articles/CBMiJmh0dHBzOi8vbmV3cy5wdHMub3JnLnR3L2FydGljbGUvNDU5MTMz0gEqaHR0cHM6Ly9uZXdzLnB0cy5vcmcudHcvYXJ0aWNsZS80NTkxMzMvYW1w?oc=5&hl=en-US&gl=US&ceid=US:en,"{'href': 'https://news.pts.org.tw', 'title': '公視新聞'}",pts,                                        大選的不分區立委各政黨號次抽籤。19個政黨中，民進黨抽中14號，國民黨9號，親民黨3號，台灣民眾黨15號，時代力量6號。一旦政黨票得票率達到5%以上的政黨，可參與分配不分區34席。大聲喊著口號，抽到14號的民進黨。希望民眾票投14號，讓民進黨延續執政4年的政績，未來能夠持續執政，守護台灣。林飛帆說：「我們會盡全力的讓全台灣的所有人知道，民主進步黨是一個實在做事的政黨，是一個實事求是的政黨。」中選會18號舉行第10屆不分區立委選舉的政黨號次抽籤，19個政黨代表都希望抽出一個好記的號碼。其中，時代力量6號，國民黨抽到9號，強調票投國民黨，可以長治久安。而抽中3號的親民黨，則打出壯大第三勢力的主張。 國民黨立院黨團總召曾銘宗說：「長治久安，國民黨為護衛國家長治久安，長長久久。」親民黨祕書長李鴻鈞則表示，「親民黨在立法院裡面，我們扮演的就是左拉右，左拉民進黨，右拉國民黨。」此外，台灣民眾黨抽中15號，也打出台灣重開機，票投15，民眾做主的口號。綠黨則抽到12號，各黨都請託民眾用選票支持，可以進入國會服務。台灣民眾黨不分區提名人賴香伶表示，「我們有這麼多專業的候選人，能夠在各地遍地開花，為台灣、為這個國家、為我們的下一代齊心努力、義無反顧。」綠黨不分區提名人鄧惠文說：「我們小黨一定要存在，因為綠黨的價值不是只有在，例如說整個藍綠中間的綠，綠黨的價值，在於永續的綠。」這次不分區立委競爭百家爭鳴，19個政黨共提出217位提名人。中選會審定後，符合者216人，如果政黨票得票率，達到5%以上的政黨，就可參與分配不分區34席。
91,查韓岳父砂石場涉不法回填 國產署開挖 ｜ 公視新聞網 PNN - 公視新聞,查韓岳父砂石場涉不法回填 國產署開挖 ｜ 公視新聞網 PNN  公視新聞,"Wed, 18 Dec 2019 08:00:00 GMT",https://news.google.com/rss/articles/CBMiJmh0dHBzOi8vbmV3cy5wdHMub3JnLnR3L2FydGljbGUvNDU5MTE20gEqaHR0cHM6Ly9uZXdzLnB0cy5vcmcudHcvYXJ0aWNsZS80NTkxMTYvYW1w?oc=5&hl=en-US&gl=US&ceid=US:en,"{'href': 'https://news.pts.org.tw', 'title': '公視新聞'}",pts,                                        為了釐清國民黨總統候選人韓國瑜岳父李日貴，經營的大通砂石場舊址是否回填不明廢棄物，國有財產署上午進行開挖。李日貴之子，雲林縣議員李明哲也到場，質疑企圖影響總統選情。大型怪手一早就定位，早上十點時間一到，工作人員開始進行開挖動作，為了釐清國民黨總統候選人韓國瑜岳父李日貴，過去經營大通砂石場舊址，是否有回填不明廢棄物，國產署會同各單位上午進行開挖。國產署中區分署長趙子賢說：「委員質疑這塊地有被掩埋廢棄物，我們基於土地管理機關立場來確認，看是不是真的有遭掩埋廢棄物。我們照正常一般程序作業，並沒有為了特定事情或特定個人。」國產屬表示，18日預計會開挖37處，並在下周一進行土壤採樣送驗，但土壤檢驗結果最快一個月才會出爐。同時強調此時開挖，是為了釐清真相依程序辦理。對此雲林縣議員李明哲表示，選在這時間開挖，就是企圖影響總統大選的結果。李明哲表示，「選舉只剩下20多天，我們這土地也早早就已經完成點交。如果點交有問題的話，國產署應該早早表示意見，而不是配合某些政治打手，在這時候來進行操作，嚴重影響選舉結果。」李明哲表示，李家砂石場退場快要20年。若真的有回填任何有害物質，怎可能還長出一片樹林？加上過去幾年有被人傾倒廢棄物，他還報警處理，也質疑此時開挖動作。國產署強調，對地下埋什麼東西，並沒有預設立場，但若有違反規定後續都將交給檢調來認定。                
92,中市無力負擔改制高中職 盼改回國立 ｜ 公視新聞網 PNN - 公視新聞,中市無力負擔改制高中職 盼改回國立 ｜ 公視新聞網 PNN  公視新聞,"Tue, 17 Dec 2019 08:00:00 GMT",https://news.google.com/rss/articles/CBMiJmh0dHBzOi8vbmV3cy5wdHMub3JnLnR3L2FydGljbGUvNDU4OTU50gEqaHR0cHM6Ly9uZXdzLnB0cy5vcmcudHcvYXJ0aWNsZS80NTg5NTkvYW1w?oc=5&hl=en-US&gl=US&ceid=US:en,"{'href': 'https://news.pts.org.tw', 'title': '公視新聞'}",pts,                                        台中市17所的國立高中職，因為升格為六都，開始改為市立，從明年開始，台中市庫將要每年增加2億多費支出，有議員提案建請回歸隸屬國立。台中市17所國立高中職從2017年改成市立，實施到現在已經快要滿三年，不過這17所市立高中職會不會成為台中市沉重的負擔，在台中市議會也引起熱烈討論。台中市藍營的市議員認為，當初雖然縣市合併升格，但是整體財政收支卻沒有進一步檢討。國民黨台中市議員陳廷秀說：「(以往只有)北高過去兩個直轄市，高中職都是市立的，因為它有足夠的財源，因為那時候統籌分配款比較充足。但你變六都之後，你沒有相對把其他直轄市的能量提升。」國民黨團認為，當初從兩都變成了六都， 但是統籌分配並沒有重新檢討，中央補助前3年的經費也要到期，接下來市庫每年要增加2億2900萬的預算。但是民進黨團認為不能夠走回頭路。民進黨台中市議員何文海表示：「台中市來講，我們的財政是滿健全的，當然你看今年的(台中市)總預算是編到兩千兩百多億，當然有一部分是(市立)高中職的一些費用。」國民兩黨看法不同，但是接下來17所 市立的高中職，財政必須由台中市府自己負擔，國民黨團提議將改隸的市立高中職，回歸隸屬國立，目前已經二讀通過，市府教育局表示，將匯集意見之後和國教署進一步討論。台中市教育局長楊振昇說：「我們每一年，包括我們市校的退撫大概要四億支出，(所以負擔滿大的)這確實是對市庫是增加一筆負擔。」台中市教育局表示，目前光是市校的退撫一年就要四億的支出，明年開始少了中央的補助負擔將更大。教育部國教署表示，將和市府討論，針對緊急需要的部分直接向中央爭取，但是細節還要進一步釐清。                 
93,糾正歷史錯亂？ 柯：2024若當選 總統府遷大直 ｜ 公視新聞網 PNN - 公視新聞,糾正歷史錯亂？ 柯：2024若當選 總統府遷大直 ｜ 公視新聞網 PNN  公視新聞,"Wed, 18 Dec 2019 08:00:00 GMT",https://news.google.com/rss/articles/CBMiJmh0dHBzOi8vbmV3cy5wdHMub3JnLnR3L2FydGljbGUvNDU5MjEy0gEqaHR0cHM6Ly9uZXdzLnB0cy5vcmcudHcvYXJ0aWNsZS80NTkyMTIvYW1w?oc=5&hl=en-US&gl=US&ceid=US:en,"{'href': 'https://news.pts.org.tw', 'title': '公視新聞'}",pts,曾經表態有意參選2024總統的台北市長柯文哲，日前在專訪的時候表示，如果當選，會把總統府遷移到大直，認為用日本總督府來作為總統府，是歷史錯亂。而鴻海創辦人郭台銘，在今天陪子弟兵李縉穎前往抽籤，對於自己被拱為藍營「新共主」，還被勸進要參選黨主席，郭台銘只說不想當官，而是以服務人民為優先。曾經表態要參選2024的台北市長柯文哲接受媒體專訪拋出，若當選，就要把總統府遷到大直，因為用日本總督府當總統府是歷史錯亂，「我們怎麼會用日本總督府，繼續當台灣的最高行政機關所在地，這有歷史錯亂，本來國防部在大直要塞區，其實我們那個衡山指揮所就在那裡，其實那個是我跟你講，大陸如果要對台灣動武的話，一定是斬首戰術，擺在那裡還蠻危險的。」選舉將近，政治人物的言行舉止格外引人注目，對國民黨主席吳敦義17日出席韓國瑜後援會活動時，以台語批評蔡英文總統執政治安差，發生多起分屍案「么壽骨」，還批評蔡總統是「衰尾查某」，引發政治效應。柯文哲認為，「是這樣啦我們就是這樣，就是私底下講一個層次，上面講要換成另外一種頻道，就是這樣。」鴻海創辦人郭台銘與民眾黨主席柯文哲結盟以來，矛盾頻傳，外界聯想兩人合作恐怕已漸行漸遠，不過18日郭台銘陪郭家軍李縉穎到新北市選委會抽籤，被問到泛藍近期有意拱郭台銘為新共主，郭台銘還是很低調。他表示，「我也不會說一定想要做官，我出來做，就是替國民黨、替所有台灣的老百姓，國家的利益要大於黨的利益，人民的利益又在國家利益之上，所以我一切以人民為主，以國家為主。」選戰進入倒數階段，搶攻選票，各政黨紛紛出招，民眾黨發起人蔡壁如18日則透露，台北市長身兼民眾黨主席柯文哲，計畫在選舉前10天，配合中選會區域立委競選時間請假輔選，力求選民支持。                 
