,title,description,published date,url,publisher,source,content
41,一邊一國行動黨選舉失利 扁宣布退出政壇 ｜ 公視新聞網 PNN - 公視新聞,一邊一國行動黨選舉失利 扁宣布退出政壇 ｜ 公視新聞網 PNN  公視新聞,"Sun, 12 Jan 2020 08:00:00 GMT",https://news.google.com/rss/articles/CBMiJmh0dHBzOi8vbmV3cy5wdHMub3JnLnR3L2FydGljbGUvNDYyNDcy0gEqaHR0cHM6Ly9uZXdzLnB0cy5vcmcudHcvYXJ0aWNsZS80NjI0NzIvYW1w?oc=5&hl=en-US&gl=US&ceid=US:en,"{'href': 'https://news.pts.org.tw', 'title': '公視新聞'}",pts,                                        由於「一邊一國行動黨」區域立委與不分區失利，前總統陳水扁今天透過聲明宣布從此退出政壇。陳水扁今天上午透過聲明指出「美好的一仗已經打過」，身為一邊一國行動黨的園丁，有心澆水，卻讓這棵新生小樹枯萎，深感愧疚，特別請辭澆水園丁一職。陳水扁說他徹夜難眠，反躬自省，自忖無能再為黨、為台灣奉獻心力，宣布從此退出政壇。                 
42,總統：台灣已是獨立國家 叫「中華民國台灣」 ｜ 公視新聞網 PNN - 公視新聞,總統：台灣已是獨立國家 叫「中華民國台灣」 ｜ 公視新聞網 PNN  公視新聞,"Wed, 15 Jan 2020 08:00:00 GMT",https://news.google.com/rss/articles/CBMiJmh0dHBzOi8vbmV3cy5wdHMub3JnLnR3L2FydGljbGUvNDYyOTA20gEqaHR0cHM6Ly9uZXdzLnB0cy5vcmcudHcvYXJ0aWNsZS80NjI5MDYvYW1w?oc=5&hl=en-US&gl=US&ceid=US:en,"{'href': 'https://news.pts.org.tw', 'title': '公視新聞'}",pts,                                        2020大選，總統蔡英文獲得八百萬選民支持，也讓未來兩岸關係的發展，備受外界關注，她接受英國BBC專訪時，宣示她的立場，認為台灣已經是一個獨立的國家，叫做中華民國台灣。而上午她在總統府，發表選後首次的公開談話，公布施行反滲透法，她重申反滲透法不是反交流，會要求行政院持續宣導，避免引發不必要的恐慌。2020大選，總統蔡英文成功連任，她上午在總統府，進行選後首次的公開談話，她提到為了維持政局穩定，已經留任行政院長蘇貞昌，也已經簽署反滲透法公告，重申反滲透法不是反交流。蔡英文表示，「構成要件是非常的嚴謹，只要不是受到中國政府的指示、委託或者資助，都屬於正常交流，不會受到影響。民眾如果還有疑慮，我已經要求行政院要做三件事情，第一件事情，我請行政院相關部會持續的宣導，避免民眾因為不了解本法的內容產生不必要的恐慌。」為了維護國家安全，蔡總統致力推動反滲透法，也讓未來兩岸的關係，備受外界關注，她接受英國媒體BBC的專訪，呼籲中國面對現實，也說台灣值得被尊重，也願意與中國對話，但台灣的主權沒有談判的空間。「我們值得中國尊重，我們不需要宣布自己是一個獨立國家，我們已經是一個獨立的國家，我們叫做中華民國台灣。我們有自己的軍隊、警隊和選舉。」蔡英文在BBC專訪中表示。蔡總統提到，過去3年，中國不斷加強對台施壓，還有香港所發生的事，讓大家意識到，中國的威脅是真實的，她努力避免激怒對岸，但不排除中國以武力犯台的可能。專訪中蔡英文指出，「任何時候都無法完全杜絕戰爭發生的可能，問題是你必須做好準備，對中國來說，入侵台灣的代價將非常巨大。」選後的兩岸關係，蔡總統拋出八個字「和平、對等、民主、對話」，但如何具體化，蔡總統表示，希望中國能從這次選舉，對台灣人民的意見與意志有深入了解，也能對他們的政策進行檢討。                 
43,小英稱我已獨立 名為「中華民國台灣」 ｜ 公視新聞網 PNN - 公視新聞,小英稱我已獨立 名為「中華民國台灣」 ｜ 公視新聞網 PNN  公視新聞,"Sun, 19 Jan 2020 08:00:00 GMT",https://news.google.com/rss/articles/CBMiJmh0dHBzOi8vbmV3cy5wdHMub3JnLnR3L2FydGljbGUvNDYzNDM00gEqaHR0cHM6Ly9uZXdzLnB0cy5vcmcudHcvYXJ0aWNsZS80NjM0MzQvYW1w?oc=5&hl=en-US&gl=US&ceid=US:en,"{'href': 'https://news.pts.org.tw', 'title': '公視新聞'}",pts,                                        總統蔡英文最近接受英國廣播公司BBC專訪，總統府公布專訪的全文，被問到是不是贊成台灣正式獨立？總統回應，我們已經是獨立的國家，叫自己是中華民國台灣。另外，被問到中國日益增加的壓力，台灣是不是可以承受「軍事行動」？蔡總統強調，侵略台灣會付出很大的代價。總統蔡英文這個月14號，在總統府內接受英國廣播公司BBC專訪，總統府18號發布新聞稿，公布專訪全文，被問到「撇開時間表和現實問題，是否贊成台灣正式獨立？」，蔡總統回應「功能上我們已經獨立的國家」，BBC追問，會不會有一天，必須明確地用台灣來稱呼，正式宣布獨立？總統強調，「我們沒有需要再次宣布自己為獨立國家，因為我們已經是獨立的國家了，我們稱自己為中華民國臺灣。」另外，總統受訪時也提及「中國日益增加的壓力」，被問到兩岸發生戰爭的風險？總統表示，任何時候都無法排除戰爭的可能性，但必須做好準備，發展自我防衛的能力。而台灣準備好了嗎？是否能承受軍事行動？蔡總統說明，「對中國來說，侵略臺灣或試圖侵略臺灣將付出很大的代價。」目前台灣只剩15個邦交國，是否能維持住？總統認為，中國不會停止奪取我友邦的企圖，然而，我們會竭盡所能地維繫我們的邦國，並強調會與區域友人合作，維持區域友穩定和平，至於未來四年的願景為何？總統宣示，會讓台灣更民主，更具競爭力，最終將使台灣成為亞洲最進步的國家。  
44,"We are an Independent Country Already: President Tsai|總統:台灣已是獨立國家 叫""中華民國台灣"" ｜ 公視新聞網 PNN - 公視新聞","We are an Independent Country Already: President Tsai|總統:台灣已是獨立國家 叫""中華民國台灣"" ｜ 公視新聞網 PNN  公視新聞","Wed, 15 Jan 2020 08:00:00 GMT",https://news.google.com/rss/articles/CBMiJmh0dHBzOi8vbmV3cy5wdHMub3JnLnR3L2FydGljbGUvNDYyOTU50gEqaHR0cHM6Ly9uZXdzLnB0cy5vcmcudHcvYXJ0aWNsZS80NjI5NTkvYW1w?oc=5&hl=en-US&gl=US&ceid=US:en,"{'href': 'https://news.pts.org.tw', 'title': '公視新聞'}",pts,"President Tsai Ing-wen has secured a second term after winning a landslide victory in the 2020 Presidential Elections. She told BBC that Taiwan is already an independent country, called Republic of China, Taiwan and that China needs to ""face reality"" and show the island ""respect"". On Jan. 15, she also made her first public address since the election.Re-elected, President Tsai In-wen made her first public address in the Presidential Office since her landslide victory on Jan. 15. In her address, she mentioned that she is keeping Premier Su Tseng-chang onboard to maintain the stability of the political environment. She also said that she had signed the Anti-Infiltration Act and reiterated that the Act will not discourage cross-strait interactions.The criteria are very strict. As long as the action is not directed, commissioned or sponsored by the Chinese government, all other interactions are considered normal and will not by impacted. Should the public still have doubts, I have already asked the Executive Yuan to do three things. The first thing is that I have asked the related departments in the Executive Yuan to continue to promote and educate, as to prevent the public from unnecessary panic that may originate from their misunderstanding of this Act.To maintain national security, Tsai is dedicated to push forward the Anti-Infiltration Act. How cross-strait relationships will be impacted has since then been placed under the spot light. In an exclusive interview with the BBC, Tsai said that China needs to ""face reality"" and respect the will of Taiwanese people. She also said that she is open to dialogue, but there won't be any room for negotiation on Taiwan's sovereignty.We deserve respect from China. We don't have a need to declare ourselves an independent state because we are an independent country already and we call ourselves Republic of China Taiwan and we do have (a) government, and we have the military and we have elections.Tsai mentioned that in the past three years, China has been intensifying its threat to Taiwan. Additionally, with what happened in Hong Kong, the situation has made everyone become aware that the threat from China is very real. She has tried to avoid provoking China, but a military invasion from China cannot be ruled out entirely.You cannot exclude the possibility of a war at any time but the thing is you have to get yourself prepared. Invading Taiwan is something that is going to be very costly for China.As for how cross-strait relations will change after the elections, Tsai gave a mantra of ""peace, parity, democracy and dialogue"". When asked on how to realize these principles, Tsai said that she hopes that China can understand Taiwanese people's beliefs and opinions better after this election, and that they can re-evaluate their policies.2020大選，總統蔡英文成功連任，她上午在總統府，進行選後首次的公開談話，她提到為了維持政局穩定，已經留任行政院長蘇貞昌，也已經簽署反滲透法公告，重申反滲透法不是反交流。總統 蔡英文表示：「構成要件是非常的嚴謹，只要不是受到中國政府的指示、委託或者資助，都屬於正常交流，不會受到影響。民眾如果還有疑慮，我已經要求行政院要做三件事情，第一件事情，我請行政院相關部會持續的宣導，避免民眾因為不了解本法的內容，產生不必要的恐慌。」為了維護國家安全，蔡總統致力推動反滲透法，也讓未來兩岸的關係，備受外界關注，她接受英國媒體BBC的專訪，呼籲中國面對現實，也說台灣值得被尊重，也願意與中國對話，但台灣的主權沒有談判的空間。總統 蔡英文 (翻攝自BBC網站)表示：「我們值得中國尊重。我們不需要宣布自己是一個獨立國家，我們已經是一個獨立的國家，我們叫做中華民國台灣，我們有自己的政府、軍隊和選舉。」蔡總統提到，過去3年，中國不斷加強對台施壓，還有香港所發生的事，讓大家意識到，中國的威脅是真實的，她努力避免激怒對岸，但不排除中國以武力犯台的可能。總統 蔡英文 (翻攝自BBC網站)表示：「任何時候都無法完全杜絕戰爭發生的可能，問題是你必須做好準備，對中國來說， 入侵台灣的代價將非常巨大。」選後的兩岸關係，蔡總統拋出八個字""和平、對等、民主、對話""，但如何具體化?蔡總統表示，希望中國能從這次選舉，對台灣人民的意見與意志，有深入了解，也能對他們的政策進行檢討。                "
45,沈一鳴殉職 海軍司令黃曙光接任參謀總長 ｜ 公視新聞網 PNN - 公視新聞,沈一鳴殉職 海軍司令黃曙光接任參謀總長 ｜ 公視新聞網 PNN  公視新聞,"Wed, 15 Jan 2020 08:00:00 GMT",https://news.google.com/rss/articles/CBMiJmh0dHBzOi8vbmV3cy5wdHMub3JnLnR3L2FydGljbGUvNDYzMDAw0gEqaHR0cHM6Ly9uZXdzLnB0cy5vcmcudHcvYXJ0aWNsZS80NjMwMDAvYW1w?oc=5&hl=en-US&gl=US&ceid=US:en,"{'href': 'https://news.pts.org.tw', 'title': '公視新聞'}",pts,黑應直升機事故，造成8位軍、士官不幸殉職，而國防部在日前舉行公奠儀式之後，今天正式宣布國軍上將的職務調整。備受關注的參謀本部上將、參謀總長職缺，將由海軍司令黃曙光上將調任，他是海軍官校68年班，曾任國防部後勤參謀次長室次長、海軍司令部司令，以及海軍司令部參謀長，至於海軍司令，是由參謀本部副參謀總長執行官劉志斌上將調任，而國防部常務次長徐衍璞中將會接任職缺，同時晉任陸軍二級上將。而國防部也指出，徐衍璞指導國防戰略規劃，還有兵力結構整建等重大工作，貢獻良多。                 
46,陳師孟強勢 稱專打辦綠不辦藍法官 ｜ 公視新聞網 PNN - 公視新聞,陳師孟強勢 稱專打辦綠不辦藍法官 ｜ 公視新聞網 PNN  公視新聞,"Fri, 17 Jan 2020 08:00:00 GMT",https://news.google.com/rss/articles/CBMiJmh0dHBzOi8vbmV3cy5wdHMub3JnLnR3L2FydGljbGUvNDYzMjQx0gEqaHR0cHM6Ly9uZXdzLnB0cy5vcmcudHcvYXJ0aWNsZS80NjMyNDEvYW1w?oc=5&hl=en-US&gl=US&ceid=US:en,"{'href': 'https://news.pts.org.tw', 'title': '公視新聞'}",pts,                                        剛剛新聞提到，監察委員陳師孟透過總統府秘書長陳菊，向蔡總統表達請辭。陳師孟立場鮮明，自從上任引來爭議不斷，現在突然閃辭，法界反應很低調。2018年1月，監察委員陳師孟說：「過去做惡、為非作歹的（法官）就是藍的嘛，所以你現在不辦藍去辦綠嗎？」上任前就先對法官宣戰，曾任總統府秘書長的監察委員陳師孟，打從被提名以來就爭議不斷。藍營猛批政黨色彩太重，尤其是曾公開表態要還前總統陳水扁清白，也被批評是干預司法。當時，監察委員陳師孟表示，「讓阿扁清白能夠還他的話。那我覺得是做為監察委員一個不可旁貸的一個責任。」陳師孟上任後第一起調查案件，就與扁案有關，調查2009年司法節慶祝大會，怒批諷刺前總統陳水扁的舞台劇是踐踏人權，但最後被要求迴避調查。藉著又對前總統馬英九洩密案判無罪不滿，說要約詢承辦的一、二審法官，引起法界反對，公開聯署反對。就連司法院都表態，捍衛司法獨立。監察委員陳師孟曾表示，「他們（法官）只是靠這種人多勢眾，或者這個所謂的連署之類的話，這個只是加深我瞧不起他們而已。」爭議言行不斷，陳師孟也被外界質疑是總統蔡英文利用來控制司法，備受批評。雖然陳師孟曾表示不以為意，但是選後卻突然閃辭，被視為是蔡政府在選後，為爭議事件設下的停損點。不過之前大力抨擊的法界，則低調回應。法官協會發言人林恆吉說：「對於總統跟監委的決定，我們敬表尊重。」司法院祕書長林輝煌則說：「就陳委員請辭一事，司法院沒有立場表示意見。」台灣人權進步協會則認為，監察權並非全然不可觸碰司法權，但必須特別謹慎，也不可以無限上綱。劍青檢改雖然不評論陳師孟請辭，但希望監察委員將來都能尊重司法獨立性。                
47,2020蔡英文力拚連任 競選團隊今授旗 ｜ 公視新聞網 PNN - 公視新聞,2020蔡英文力拚連任 競選團隊今授旗 ｜ 公視新聞網 PNN  公視新聞,"Sun, 01 Sep 2019 07:00:00 GMT",https://news.google.com/rss/articles/CBMiJmh0dHBzOi8vbmV3cy5wdHMub3JnLnR3L2FydGljbGUvNDQ0NDQw0gEqaHR0cHM6Ly9uZXdzLnB0cy5vcmcudHcvYXJ0aWNsZS80NDQ0NDAvYW1w?oc=5&hl=en-US&gl=US&ceid=US:en,"{'href': 'https://news.pts.org.tw', 'title': '公視新聞'}",pts,2020總統大選競爭激烈，總統蔡英文拚連任，今天舉行競選團隊的全國授證大會，也親自授旗。競選辦公室總幹事林錫耀強調，面對網路的影響力越來越大，會加強網路戰，來拚2020勝選。一早出席競選團隊的全國授證大會，總統蔡英文展現好心情。面對2020總統選舉，藍營有韓國瑜將挑戰蔡總統連任，另外鴻海創辦人郭台銘等人，都傳出可能加入戰局，綠營選戰布局更是積極，上、下午兩場授證大會，也象徵各地的競選團隊正式動起來。蔡英文競選辦公室總幹事林錫耀表示，「網路的影響力越來越大，所以傳統在各地的組織戰，當然就必須適應這一個新的社會潮流。」蔡英文競選辦公室副總幹事沈發惠也說，「各後援會往前，等於今天開始啟動，大家大步向前邁進。」而在地方競選工作分配上，綠營執政的6縣市首長，都將擔任該縣市蔡英文競選總部的主委，把地方票鞏固起來。蔡英文基隆競總主委林右昌說，「我對我們的同志有信心，也希望大家繼續給民進黨支持、給民進黨機會。」蔡英文桃園競總主委鄭文燦也表示，「距離1月11號投票日，還有將近4個多月的時間，我想我們會配合競選總部的規劃、往前走。」林錫耀強調，目前距離大選還有4個月，面對各種戰情的變化，民進黨更要戰戰兢兢，不能掉以輕心，以求2020勝選。                 
48,天下調查縣市長施政滿意度 潘孟安居首 ｜ 公視新聞網 PNN - 公視新聞,天下調查縣市長施政滿意度 潘孟安居首 ｜ 公視新聞網 PNN  公視新聞,"Tue, 10 Sep 2019 07:00:00 GMT",https://news.google.com/rss/articles/CBMiJmh0dHBzOi8vbmV3cy5wdHMub3JnLnR3L2FydGljbGUvNDQ1NzI00gEqaHR0cHM6Ly9uZXdzLnB0cy5vcmcudHcvYXJ0aWNsZS80NDU3MjQvYW1w?oc=5&hl=en-US&gl=US&ceid=US:en,"{'href': 'https://news.pts.org.tw', 'title': '公視新聞'}",pts,                                        天下雜誌在今天公布了2019年的縣市首長施政滿意度調查，第一名是由屏東縣長潘孟安拿下，第二名是連江縣長劉增應，第三名是花蓮縣長徐榛蔚，至於第四、第五名，分別是桃園市長鄭文燦，還有台東縣長饒慶鈴。而排名最後五名，分別是苗栗縣長徐耀昌、彰化縣長王惠美、台北市長柯文哲、台中市長盧秀燕，至於成績墊底的是高雄市長韓國瑜。
49,內政、警政首長赴高雄坐鎮 被指為卡韓 ｜ 公視新聞網 PNN - 公視新聞,內政、警政首長赴高雄坐鎮 被指為卡韓 ｜ 公視新聞網 PNN  公視新聞,"Fri, 20 Sep 2019 07:00:00 GMT",https://news.google.com/rss/articles/CBMiJmh0dHBzOi8vbmV3cy5wdHMub3JnLnR3L2FydGljbGUvNDQ3MDY20gEqaHR0cHM6Ly9uZXdzLnB0cy5vcmcudHcvYXJ0aWNsZS80NDcwNjYvYW1w?oc=5&hl=en-US&gl=US&ceid=US:en,"{'href': 'https://news.pts.org.tw', 'title': '公視新聞'}",pts,                                        對於高雄的治安，警政署罕見派刑事局長南下坐鎮，有外界解讀，是要卡高雄市長韓國瑜，行政院長蘇貞昌認為，治安問題牽拖政治是鬧劇，內政部長徐國勇也說若韓國瑜把治安做好、第一天就把事情處理好的話「誰會去卡他」。高雄市接連幾天都發生街頭暴力事件，警政署罕見派出刑事局長黃明昭南下坐鎮，內政部長徐國勇20日也將到高雄了解狀況，不過也被解讀是在卡高雄市長韓國瑜，行政院長蘇貞昌認為治安問題扯到政治、是鬧劇。蘇貞昌說：「對於中央關心地方又要扯到政治上，這一種所謂卡來卡去這種說法，都是鬧劇。」內政部長徐國勇表示：「我想是他(韓國瑜)自己的解讀，沒有人會去卡他，他如果把治安做得好誰會卡他，第一天就把事情壓制下來誰會去卡他？」徐國勇強調不能讓街頭鬥毆的模仿跟擴散效應從高雄發生。先前桃園、屏東都發生重大治安事件，中央並未大動作派人坐鎮，藍委認為中央對高雄有針對性。國民黨立委李彥秀說：「處理治安問題當然中央跟地方一起來，但是有針對性的，我覺得這個就是把整個行政系統當作民進黨的選戰在打。」民進黨立委趙天麟認為：「我希望韓市長可不可以稍微專心一點坐鎮高雄，把這樣的一個治安情況把它底定下來再投入選舉，我想讓市民解除不安應該是他最起碼的義務。」蘇貞昌強調，地方警政首長負責地方治安，但當地方有重大治安疑慮，中央派相關首長下去協助，並無不妥，警政全國一體，人民要求的治安，也不該有所區別，治安做好，人民才能安居樂業。                
50,郭台銘昨深夜發聲明 不參與連署競選總統 ｜ 公視新聞網 PNN - 公視新聞,郭台銘昨深夜發聲明 不參與連署競選總統 ｜ 公視新聞網 PNN  公視新聞,"Tue, 17 Sep 2019 07:00:00 GMT",https://news.google.com/rss/articles/CBMiJmh0dHBzOi8vbmV3cy5wdHMub3JnLnR3L2FydGljbGUvNDQ2NTA50gEqaHR0cHM6Ly9uZXdzLnB0cy5vcmcudHcvYXJ0aWNsZS80NDY1MDkvYW1w?oc=5&hl=en-US&gl=US&ceid=US:en,"{'href': 'https://news.pts.org.tw', 'title': '公視新聞'}",pts,                                        鴻海創辦人郭台銘，昨天深夜發表聲明，決定不參與2020連署競選總統；他表示，要向所有期盼他出來參選的好朋友們，深深一鞠躬、表示歉意。國民黨對此回應，感受到郭董、國際級企業家的高度與氣度；韓國瑜競選辦公室則表示，會盡一切努力，爭取郭台銘的支持，也希望有機會當面向郭董請益。深夜拋出震撼彈，鴻海創辦人郭台銘辦公室發出聲明，正式表態不參與2020年總統大選。郭台銘一開始就表示，人生充滿著各種大大小小的決定。有些決定很容易，有些決定很困難。自己不斷思考，什麼才是真正的承擔。他說參選總統的初衷，是希望能夠帶領台灣社會齊心拚經濟，但投身選戰以來，看到的卻是一些政治人物為了私利，挑起階級、仇恨、對立等民粹。經過再三思考之後，希望讓社會在關注國家領導人的選擇時，能夠回歸理性思考與政策層面的討論，於是決定不參與2020連署競選總統。郭台銘也在聲明中向支持者深深一鞠躬，表達歉意，表示：「對不起，讓你們失望了！」聲明結尾也強調，自己依然是永遠的中華民國派，當中華民國需要郭台銘的時候，郭台銘永遠都在。 針對郭台銘的聲明，國民黨回應，他們感受到郭台銘國際級企業家的高度與氣度，並呼籲國民黨同志必當團結一致，全力輔選總統與立委參選提名人，總統勝選，立委達到60席目標，重返執政、撥亂反正。韓國瑜競選辦公室隨即也表示，會盡一切努力，爭取郭台銘的支持，也希望有機會當面向郭董請益。並且說郭董和韓國瑜擁有相同的目標，都希望全力為台灣人民拚經濟，捍衛中華民國，期待中華民國有更好的發展。此外，前副總統呂秀蓮辦公室，16號晚間也發出新聞稿指出，呂秀蓮數月來受到各界人士鼓勵，決定接受喜樂島聯盟，及其他政黨的推薦，將向中選會登記，申請為獨立總統參選人。 
51,三重碧華布街 全盛時期逾300家布店 ｜ 公視新聞網 PNN - 公視新聞,三重碧華布街 全盛時期逾300家布店 ｜ 公視新聞網 PNN  公視新聞,"Mon, 21 Oct 2019 07:00:00 GMT",https://news.google.com/rss/articles/CBMiJmh0dHBzOi8vbmV3cy5wdHMub3JnLnR3L2FydGljbGUvNDUxMjEy0gEqaHR0cHM6Ly9uZXdzLnB0cy5vcmcudHcvYXJ0aWNsZS80NTEyMTIvYW1w?oc=5&hl=en-US&gl=US&ceid=US:en,"{'href': 'https://news.pts.org.tw', 'title': '公視新聞'}",pts,新北市三重碧華街是有40年歷史的「布街」，當年風光的全盛時期一條街有300多家布店，甚至吸引外國顧客來買布。一大清早里長親切地向居民問候，漫步在新北市三重的碧華街，沿途路燈上都掛有布字圓圈，這裡是俗稱的碧華布莊博物園區。目前碧華布街聚集了20多家的布行，無論是七彩炫爛的花紋，或是簡單又不失質感的單色布款，在這裡應有盡有。布行老闆蕭天賜表示，「在這裡差不多做布做三十幾年，但是這個布街最早慢慢形成起來，最多的時候在這裡有三百多間。」民國80年代以後，台灣紡織業逐漸式微，這也連帶影響到整條布街的生意。所幸年輕一代腦筋動得快，結合自家布料加上一條背帶，只需要簡單的幾個步驟，就能變身為時尚的包包。蕭天賜說，「做布生意比較沒那麼好的時候，我兒子才開始自己研發這條出來，我們都說一句話，你來這裡就是尋寶，尋寶你要每間找，找你喜歡的，一定讓你找得到。」三重碧華布街不僅僅是布料靜態的展示，更是充滿居民活力與濃濃人情味的動態博物館，有興趣的民眾不仿閒暇之餘來布街挖寶，感受布街的歷史與文化。                 
